Label,# Samples,Average,Median,90% Line,95% Line,99% Line,Min,Max,Error %,Throughput,Received KB/sec,Sent KB/sec
S00.01.01 Check home page,1,1254,1254,1254,1254,1254,1254,1254,0.000%,.79745,359.02,0.91
S00.01 Check home page,1,1254,1254,1254,1254,1254,1254,1254,0.000%,.79681,358.74,0.91
S00.02.01 Check auth page,1,24,24,24,24,24,24,24,0.000%,41.66667,52.29,17.05
S00.02 Check auth page,1,24,24,24,24,24,24,24,0.000%,41.66667,52.29,17.05
S00.03.01 Login,89,1129,1096,1361,1559,2019,553,2171,1.124%,1.29585,200.30,1.55
S00.03.02 Get Notification Number,1,28,28,28,28,28,28,28,0.000%,35.71429,7.92,26.79
S00.03.03 Get Number New Messages,1,30,30,30,30,30,30,30,0.000%,33.33333,7.19,25.29
S00.03.04 Get All Custom Domain List,1,27,27,27,27,27,27,27,0.000%,37.03704,8.14,29.48
S00.03.05 Get Category List,1,77,77,77,77,77,77,77,0.000%,12.98701,38.58,9.88
S00.03 Login,1,853,853,853,853,853,853,853,0.000%,1.17096,179.95,5.00
Login Controller,1,2131,2131,2131,2131,2131,2131,2131,0.000%,.46882,283.71,2.73
S01.01 Search Post Ntech,246,59,33,92,157,578,26,937,0.000%,3.66524,0.85,1.32
S02.01 Create Draft,52,57,39,105,155,173,29,416,0.000%,.77767,3.86,0.63
S02.02 Save Draft,52,52,44,75,87,120,33,199,0.000%,.77862,4.08,0.82
S05.01 Down Vote In Post,644,103,63,205,316,622,38,1474,0.155%,9.55745,3.77,8.45
Down Vote Post Controller,755,177,69,532,645,977,38,1590,0.265%,11.20311,4.16,9.91
S04.01 Up Vote In Post,633,105,65,188,321,744,21,1319,0.158%,9.39099,3.70,8.30
Up Vote Post Controller,633,105,65,188,321,744,21,1319,0.158%,9.39086,3.70,8.30
S01.02 Search Tag Ntech,246,156,117,237,343,786,76,1341,0.407%,3.65381,298.89,1.31
S01.02 Search User Ntech,245,55,36,72,138,529,29,642,0.000%,3.66552,1.54,1.32
Search Controller,245,270,204,398,707,939,137,1744,0.000%,3.65192,302.30,3.94
S02.03 Create Post,52,117,94,190,224,337,61,368,0.000%,.77822,4.18,0.86
S02.04 Delete Draft,52,59,41,81,102,334,31,352,0.000%,.77919,3.96,0.69
S06.01 Up Vote Comment Controller,119,565,545,721,791,1161,188,1634,0.840%,1.76589,0.43,1.56
Up Vote Comment Controller,119,565,545,721,791,1161,188,1634,0.840%,1.76584,0.43,1.56
S07.01 Down Vote In Comment,111,605,573,756,977,1327,326,1590,0.901%,1.64710,0.40,1.46
S02.05 Get Post After Post,52,276,251,434,483,513,142,589,0.000%,.77704,4.90,0.60
S02.06 Get Comment In Post,52,77,40,185,204,478,29,552,0.000%,.78058,0.21,0.61
S02.07 Get Emoji In Post,52,24,24,25,26,30,23,31,0.000%,.78070,2.42,0.26
S02.08 Get Random Post,52,253,180,414,647,845,47,915,1.923%,.78044,11.85,0.26
Create Post Controller,52,920,860,1208,1335,1501,606,1537,1.923%,.77108,35.08,4.69
S09.01 Follow TopUser 40651,54,72,34,79,113,485,28,1167,0.000%,.82157,2.94,0.69
S00.00 Unfollow TopUser 40651,54,57,31,54,211,393,27,478,0.000%,.82166,2.86,0.69
Login To Follow User,54,1236,1164,1506,1632,2162,856,2411,0.000%,.80774,131.33,2.33
S02.09 Get Post By Slug,51,277,237,426,675,813,123,875,0.000%,.77650,4.90,0.60
S02.10 Delete Post,51,98,60,191,273,317,39,664,0.000%,.77828,0.39,0.65
Delete Post Controller,51,375,314,597,784,855,169,981,0.000%,.77604,5.29,1.25
S00.03.02 Get user data info,33,464,460,596,611,627,1,627,3.030%,.50023,2.27,0.19
Get User Info Controller,33,1662,1643,2033,2059,2665,1223,2665,3.030%,.49053,79.55,0.77
S08.01 Get chat group,33,145,105,311,396,456,57,456,0.000%,.50210,1.18,0.40
S08.02 Request single chat,33,74,54,112,201,364,0,364,3.030%,.50237,2.29,0.39
S08.03 Seen message in chat group,33,53,39,76,127,198,9,198,6.061%,.50272,0.28,0.42
S08.04 Send message to Amealia,1,132,132,132,132,132,132,132,0.000%,7.57576,38.63,10.45
Inbox from testyopmail to Amealia,1,311,311,311,311,311,311,311,0.000%,3.20513,40.83,12.28
S08.04 Send message to zuien.adn,1,115,115,115,115,115,115,115,0.000%,8.69565,44.36,12.01
Inbox from testyopmail to zuien.adn,1,662,662,662,662,662,662,662,0.000%,1.50602,19.33,5.78
S08.04 Send message to A_circleQi,1,76,76,76,76,76,76,76,0.000%,13.15789,63.36,14.47
Inbox from testyopmail to A_circleQi,1,554,554,554,554,554,554,554,0.000%,1.79211,21.67,6.37
S08.04 Send message to arecafevn,1,52,52,52,52,52,52,52,0.000%,19.23077,98.16,26.55
Inbox from testyopmail to arecafevn,1,221,221,221,221,221,221,221,0.000%,4.27350,54.91,16.39
S08.04 Send message to duy,1,167,167,167,167,167,167,167,0.000%,5.98802,30.44,8.23
Inbox from testyopmail to duy,1,377,377,377,377,377,377,377,0.000%,2.64550,33.90,10.11
S08.04 Send message to halephuongthao,1,69,69,69,69,69,69,69,0.000%,14.49275,74.19,20.08
Inbox from testyopmail to halephuongthao,1,358,358,358,358,358,358,358,0.000%,2.67380,34.54,10.28
S08.04 Send message to athac12,1,84,84,84,84,84,84,84,0.000%,11.90476,60.66,16.42
Inbox from testyopmail to athac12,1,376,376,376,376,376,376,376,0.000%,2.53807,32.66,9.72
S08.04 Send message to nhannguyen,1,100,100,100,100,100,100,100,0.000%,10.00000,51.62,14.01
Inbox from testyopmail to nhannguyen,1,375,375,375,375,375,375,375,0.000%,2.65252,34.45,10.23
S08.04 Send message to Thuytienlunglinh,1,95,95,95,95,95,95,95,0.000%,10.52632,50.94,11.64
Inbox from testyopmail to Thuytienlunglinh,1,260,260,260,260,260,260,260,0.000%,3.83142,47.11,13.66
S08.04 Send message to PercyJ,1,72,72,72,72,72,72,72,0.000%,13.88889,71.61,19.44
Inbox from testyopmail to PercyJ,1,290,290,290,290,290,290,290,0.000%,3.44828,45.00,13.28
S08.04 Send message to troglodyte,1,70,70,70,70,70,70,70,0.000%,14.28571,72.98,19.74
Inbox from testyopmail to troglodyte,1,460,460,460,460,460,460,460,0.000%,2.16920,26.80,8.32
S08.04 Send message to anhnhan31,1,221,221,221,221,221,221,221,0.000%,4.52489,21.78,4.97
Inbox from testyopmail to anhnhan31,1,430,430,430,430,430,430,430,0.000%,2.32558,27.23,8.26
S08.04 Send message to Halephuongthao96,1,86,86,86,86,86,86,86,0.000%,11.62791,59.66,16.14
Inbox from testyopmail to Halephuongthao96,1,424,424,424,424,424,424,424,0.000%,2.30415,28.76,8.87
S08.04 Send message to 6septsg,1,469,469,469,469,469,469,469,0.000%,2.13220,10.99,2.98
Inbox from testyopmail to 6septsg,1,791,791,791,791,791,791,791,0.000%,1.26422,15.85,4.87
S08.04 Send message to whatevermn1997,1,89,89,89,89,89,89,89,0.000%,11.23596,57.49,15.57
Inbox from testyopmail to whatevermn1997,1,381,381,381,381,381,381,381,0.000%,2.61780,32.52,10.06
S08.04 Send message to Summer_melody,1,46,46,46,46,46,46,46,0.000%,21.73913,111.33,30.10
Inbox from testyopmail to Summer_melody,1,223,223,223,223,223,223,223,0.000%,4.48430,55.97,17.23
S08.04 Send message to longkhtc,1,86,86,86,86,86,86,86,0.000%,11.62791,59.93,16.27
Inbox from testyopmail to longkhtc,1,327,327,327,327,327,327,327,0.000%,3.04878,38.26,11.75
S08.04 Send message to ooanhkieu,1,93,93,93,93,93,93,93,0.000%,10.75269,55.54,15.10
Inbox from testyopmail to ooanhkieu,1,263,263,263,263,263,263,263,0.000%,3.75940,47.36,14.51
S08.04 Send message to P H A N,1,271,271,271,271,271,271,271,100.000%,3.69004,16.69,5.09
Inbox from testyopmail to P H A N,1,418,418,418,418,418,418,418,100.000%,2.27273,26.98,6.84
S08.04 Send message to tuantrece,1,64,64,64,64,64,64,64,0.000%,15.62500,80.63,21.88
Inbox from testyopmail to tuantrece,1,385,385,385,385,385,385,385,0.000%,2.59740,32.79,10.01
S08.04 Send message to janienguyen,1,62,62,62,62,62,62,62,0.000%,16.12903,77.75,17.75
Inbox from testyopmail to janienguyen,1,230,230,230,230,230,230,230,0.000%,4.32900,51.44,15.40
S08.04 Send message to ngoctranvt510,1,113,113,113,113,113,113,113,0.000%,8.84956,45.22,12.25
Inbox from testyopmail to ngoctranvt510,1,709,709,709,709,709,709,709,0.000%,1.40845,17.60,5.41
S08.04 Send message to Alittleying,1,101,101,101,101,101,101,101,0.000%,9.90099,50.60,13.69
Inbox from testyopmail to Alittleying,1,619,619,619,619,619,619,619,0.000%,1.61031,20.03,6.18
S08.04 Send message to tuanpa,1,87,87,87,87,87,87,87,0.000%,11.49425,58.75,15.94
Inbox from testyopmail to tuanpa,1,262,262,262,262,262,262,262,0.000%,3.58423,44.52,13.76
S08.04 Send message to namaman,1,63,63,63,63,63,63,63,0.000%,15.87302,80.82,21.89
Inbox from testyopmail to namaman,1,414,414,414,414,414,414,414,0.000%,2.40385,29.88,9.21
S08.04 Send message to Susu_VN,1,64,64,64,64,64,64,64,0.000%,15.62500,79.68,21.55
Inbox from testyopmail to Susu_VN,1,585,585,585,585,585,585,585,0.000%,1.70648,21.20,6.54
S08.04 Send message to ngophuonglinh0826,1,58,58,58,58,58,58,58,0.000%,17.24138,83.51,19.08
Inbox from testyopmail to ngophuonglinh0826,1,195,195,195,195,195,195,195,0.000%,5.10204,60.16,18.21
S08.04 Send message to alittlething_01,1,108,108,108,108,108,108,108,0.000%,9.25926,44.78,10.23
Inbox from testyopmail to alittlething_01,1,279,279,279,279,279,279,279,0.000%,3.34448,39.42,11.92
S08.04 Send message to hoanghatt89,1,47,47,47,47,47,47,47,0.000%,21.27660,108.88,29.44
Inbox from testyopmail to hoanghatt89,1,215,215,215,215,215,215,215,0.000%,4.65116,57.64,17.86
S08.04 Send message to thanhdo,1,77,77,77,77,77,77,77,0.000%,12.98701,66.23,17.93
Inbox from testyopmail to thanhdo,1,269,269,269,269,269,269,269,0.000%,3.70370,45.92,14.20
S08.04 Send message to normalguy,1,65,65,65,65,65,65,65,0.000%,15.38462,78.82,21.38
Inbox from testyopmail to normalguy,1,304,304,304,304,304,304,304,0.000%,3.26797,40.56,12.56
S08.04 Send message to maysaytoc124,1,46,46,46,46,46,46,46,0.000%,21.73913,111.24,30.08
Inbox from testyopmail to maysaytoc124,1,276,276,276,276,276,276,276,0.000%,3.62319,44.89,13.92
S00.04.01 Logout ,1,356,356,356,356,356,356,356,0.000%,2.80899,15.33,6.24
S00.04.02 User Signout,1,221,221,221,221,221,221,221,0.000%,4.52489,22.38,8.01
S00.04.03 Check Global Identity,1,137,137,137,137,137,137,137,0.000%,7.29927,29.52,6.52
S00.04.04 Get Random Post,1,141,141,141,141,141,141,141,0.000%,7.09220,149.19,2.42
S00.04 Logout,1,855,855,855,855,855,855,855,0.000%,1.16414,41.31,6.08
Logout Controller,1,855,855,855,855,855,855,855,0.000%,1.16414,41.31,6.08
TOTAL,5113,211,76,581,853,1441,0,2665,0.372%,72.19712,1102.85,66.14
